{"v":1,"messageId":"9a1b2c3d-0000-4000-8000-0000000000a1","type":"node.stats","flowId":"f-7f3a","instanceId":"data2flow-flow-engine-0","t":"2026-07-15T05:08:00Z","version":13,"stats":[{"nodeId":"n-trg-1","in":60,"out":{"out":60},"errors":0,"lastAt":"2026-07-15T05:08:00Z","status":"OK"},{"nodeId":"n-thr-1","in":60,"out":{"false":59,"true":1},"errors":0,"lastAt":"2026-07-15T05:08:00Z","status":"OK"},{"nodeId":"n-act-1","in":1,"out":{"ok":0},"errors":1,"lastAt":"2026-07-15T05:08:00Z","status":"ERROR","lastError":"COMMAND_RATE_LIMITED"}]}
